{
  "schema_id": "https://rpax.io/schemas/xaml-workflow-collection.json",
  "schema_version": "1.0.0",
  "collected_at": "2025-10-11T10:04:05Z",
  "workflows": [
    {
      "schema_id": "https://rpax.io/schemas/xaml-workflow.json",
      "schema_version": "1.0.0",
      "id": "wf:sha256:065c5b82dcade88f",
      "name": "test_sample",
      "activities": [
        {
          "id": "act:sha256:3d10ca250cd29769",
          "type": "Assign",
          "type_short": "Assign",
          "display_name": "Set Result (Then)",
          "children": [],
          "depth": 4
        },
        {
          "id": "act:sha256:5242aa18e33e37be",
          "type": "If.Then",
          "type_short": "Then",
          "children": [
            "act:sha256:3d10ca250cd29769"
          ],
          "depth": 3
        },
        {
          "id": "act:sha256:567344b71c11b57f",
          "type": "If.Else",
          "type_short": "Else",
          "children": [
            "act:sha256:6ee83d5fa8b7fa0a"
          ],
          "depth": 3
        },
        {
          "id": "act:sha256:6ee83d5fa8b7fa0a",
          "type": "Assign",
          "type_short": "Assign",
          "display_name": "Set Result (Else)",
          "children": [],
          "depth": 4
        },
        {
          "id": "act:sha256:af0fe2dbc4f28931",
          "type": "Assign",
          "type_short": "Assign",
          "display_name": "Initialize Counter",
          "children": [],
          "depth": 2
        },
        {
          "id": "act:sha256:b2076ac4316cc95c",
          "type": "Sequence",
          "type_short": "Sequence",
          "display_name": "Main Sequence",
          "children": [
            "act:sha256:af0fe2dbc4f28931",
            "act:sha256:dbba7e02f4b920ca"
          ],
          "depth": 1
        },
        {
          "id": "act:sha256:daeb9572cc218671",
          "type": "Activity",
          "type_short": "Activity",
          "children": [
            "act:sha256:b2076ac4316cc95c"
          ],
          "depth": 0
        },
        {
          "id": "act:sha256:dbba7e02f4b920ca",
          "type": "If",
          "type_short": "If",
          "display_name": "Check Counter",
          "children": [
            "act:sha256:5242aa18e33e37be",
            "act:sha256:567344b71c11b57f"
          ],
          "depth": 2
        }
      ],
      "edges": [
        {
          "id": "edge:sha256:833fddbe3da72b48",
          "from_id": "act:sha256:af0fe2dbc4f28931",
          "to_id": "act:sha256:dbba7e02f4b920ca",
          "kind": "Next"
        }
      ]
    }
  ],
  "issues": []
}
